{
  "schemaVersion": "1.0.0",
  "jobId": "festival-master:stretch-service-cylinder-harlan-044:rev-1:video-1",
  "scriptId": "script:light-delay-festival-master",
  "stretchId": "festival-master:stretch-service-cylinder-harlan-044",
  "providerSnapshotId": "provider:higgsfield:seedance-2.5:2026-08-29",
  "inputDigest": "3abae17609025aea8f7db5c0cfca53df8c21a17592e036a56c361284f17aab46",
  "sourceRunId": "run:festival-master:stretch-service-cylinder-harlan-044:rev-1:video-1:ready",
  "sourceRunPath": "reports/runs/run-festival-master-stretch-service-cylinder-harlan-044-rev-1-video-1-ready.json",
  "providerJobId": "80c33c08-274d-4251-8997-0afd2138c0ec",
  "provider": "higgsfield-mcp-official",
  "model": "seedance-2.5",
  "artifact": "video",
  "status": "pending_review",
  "creditsSpent": 15,
  "submittedAt": "2026-09-15T21:48:00Z",
  "completedAt": "2026-09-15T22:18:31.967Z",
  "uploadHandles": {
    "asset:festival-master-storyboard-044": "3c4a3f2b-06f7-4b70-aff3-668815c27cf9",
    "asset:character-voss-sheet": "88fed050-c15b-4950-a779-d67ec203a29f",
    "asset:character-harlan-sheet": "a4cfc514-9708-4a76-80d8-a8b38979eec9",
    "asset:object-wired-comms-deck-patch-panel-sheet": "c8518faa-615f-4caa-a81c-1b5e482d6f0b",
    "asset:voice-ref-en-harlan": "5a68b791-75e3-49ec-9924-1294a27df1b8",
    "asset:voice-ref-en-voss": "a53f345b-1044-408c-91e2-e0d37ea9a6d8"
  },
  "output": {
    "repoPath": "static/assets/animatic/frames/festival-master/stretches/festival-master-stretch-service-cylinder-harlan-044/festival-master-stretch-service-cylinder-harlan-044-rev-1-video-1.mp4",
    "sha256": "6cd3a1af1675fe04f14665a87fe810bb8c52cb79e5912b86fe7db1c80cae4004",
    "durationMs": 5042,
    "width": 854,
    "height": 480,
    "mimeType": "video/mp4"
  },
  "declaredDurationMs": 5042,
  "notes": "044 regen: author-selected 044-b0 keyframe; restored to disk after concurrent overwrite; declined IN THE DARK.",
  "registeredAssetId": "asset:festival-master-stretch-service-cylinder-harlan-044-rev-1-video-1-video"
}
