{
  "schemaVersion": "1.0.0",
  "jobId": "festival-master:stretch-service-cylinder-harlan-okoye-045b:rev-1:video-1",
  "scriptId": "script:light-delay-festival-master",
  "stretchId": "festival-master:stretch-service-cylinder-harlan-okoye-045b",
  "providerSnapshotId": "provider:higgsfield:seedance-2.5:2026-08-29",
  "inputDigest": "db4c824c1561f0452d7fbe92ffa1a835360931dee7cf74e8caca7d4d29db62b6",
  "sourceRunId": "run:festival-master:stretch-service-cylinder-harlan-okoye-045b:rev-1:video-1:ready",
  "sourceRunPath": "reports/runs/run-festival-master-stretch-service-cylinder-harlan-okoye-045b-rev-1-video-1-ready.json",
  "providerJobId": "d5d7f326-a3fd-4abb-8b72-7cfffb26eb92",
  "provider": "higgsfield-mcp-official",
  "model": "seedance-2.5",
  "artifact": "video",
  "status": "pending_review",
  "creditsSpent": 12,
  "submittedAt": "2026-09-15T21:02:00Z",
  "completedAt": "2026-09-15T21:07:35.934Z",
  "uploadHandles": {
    "asset:festival-master-storyboard-045b": "51f1f0eb-5410-411a-93ca-f4967030a5b9",
    "asset:character-harlan-sheet": "a4cfc514-9708-4a76-80d8-a8b38979eec9",
    "asset:character-okoye-sheet": "d275cf75-6828-4acc-8d27-dba850214e29"
  },
  "output": {
    "repoPath": "static/assets/animatic/frames/festival-master/stretches/festival-master-stretch-service-cylinder-harlan-okoye-045b/festival-master-stretch-service-cylinder-harlan-okoye-045b-rev-1-video-1.mp4",
    "sha256": "d676cbfbde058f4fe1a759b3560a7d46d9c10e813b5bd13f5072eeb6b85f58bd",
    "durationMs": 3583,
    "width": 854,
    "height": 480,
    "mimeType": "video/mp4"
  },
  "declaredDurationMs": 3583,
  "notes": "Scene 16 shot 045b silent cylinder transit. Trimmed provider ~4s clip; declaredDurationMs aligned to measured for register.",
  "registeredAssetId": "asset:festival-master-stretch-service-cylinder-harlan-okoye-045b-rev-1-video-1-video"
}
