{
  "schemaVersion": "1.0.0",
  "jobId": "festival-master:stretch-reactor-sorell-042-043:rev-1:video-1",
  "scriptId": "script:light-delay-festival-master",
  "stretchId": "festival-master:stretch-reactor-sorell-042-043",
  "providerSnapshotId": "provider:higgsfield:seedance-2.5:2026-08-29",
  "inputDigest": "45fe77cdeff93bd36896cfd16a8feadf83835a2c7b493314dde3cd9e3c0ab54b",
  "sourceRunId": "run:festival-master:stretch-reactor-sorell-042-043:rev-1:video-1:ready",
  "sourceRunPath": "reports/runs/run-festival-master-stretch-reactor-sorell-042-043-rev-1-video-1-ready.json",
  "providerJobId": "9e8e6c5f-c366-4527-80fb-cdb41f9d2e8b",
  "provider": "higgsfield-mcp-official",
  "model": "seedance-2.5",
  "artifact": "video",
  "status": "pending_review",
  "creditsSpent": 27,
  "submittedAt": "2026-09-15T20:58:00Z",
  "completedAt": "2026-09-15T21:06:28.605Z",
  "uploadHandles": {
    "asset:festival-master-storyboard-042": "e4da4f83-2e0e-44f4-98ea-4964e3a2f96a",
    "asset:character-sorell-sheet": "6ad0326d-d672-4834-b2ac-14e748528407",
    "asset:voice-ref-en-sorell": "9b905fc4-c6c4-4dc6-8773-76977f54d2ed"
  },
  "output": {
    "repoPath": "static/assets/animatic/frames/festival-master/stretches/festival-master-stretch-reactor-sorell-042-043/festival-master-stretch-reactor-sorell-042-043-rev-1-video-1.mp4",
    "sha256": "95bd51622715f0935900e267992fdc1e4d6d01270306b27dcf14585c60479468",
    "durationMs": 9042,
    "width": 854,
    "height": 480,
    "mimeType": "video/mp4"
  },
  "declaredDurationMs": 9380,
  "notes": "Scene 16 shot 042. Blood/injury motion from Codex keyframe. Parallel batch 042-044.",
  "registeredAssetId": "asset:festival-master-stretch-reactor-sorell-042-043-rev-1-video-1-video"
}
