{
  "schemaVersion": "1.0.0",
  "jobId": "festival-master:stretch-vault-recovery-080-082:rev-1:video-1",
  "scriptId": "script:light-delay-festival-master",
  "stretchId": "festival-master:stretch-vault-recovery-080-082",
  "providerSnapshotId": "provider:higgsfield:seedance-2.5:2026-08-29",
  "inputDigest": "31b4c9266cf0d0b53ca4bd5ba280e3fe9088c1e149256588aa9fb442d1b946ae",
  "sourceRunId": "run:festival-master:stretch-vault-recovery-080-082:rev-1:video-1:ready",
  "sourceRunPath": "reports/runs/run-festival-master-stretch-vault-recovery-080-082-rev-1-video-1-ready.json",
  "providerJobId": "95ba9e77-e95c-45de-b3a0-82b8f979e9a1",
  "provider": "higgsfield-mcp-official",
  "model": "seedance-2.5",
  "artifact": "video",
  "status": "pending_review",
  "creditsSpent": 60,
  "submittedAt": "2026-09-14T22:39:30Z",
  "completedAt": "2026-09-14T22:47:00Z",
  "uploadHandles": {
    "asset:festival-master-stretch-vault-recovery-080-082-panel-01": "71361bf8-0734-493d-9740-30e303368cd3",
    "asset:festival-master-stretch-vault-recovery-080-082-panel-02": "4fc64944-d89a-4b92-ae41-29b57668d902",
    "asset:character-harlan-sheet": "f042ff41-e790-4f82-9556-4429e4d6358b",
    "asset:character-okoye-sheet": "d275cf75-6828-4acc-8d27-dba850214e29",
    "asset:character-rao-sheet": "b33b42f4-3abf-457e-af8c-3f769025cbc1",
    "asset:character-voss-sheet": "c961ec6e-b973-4859-bead-9d13499ac9ac",
    "asset:voice-ref-en-elin": "a9d6664b-a8e4-4939-b3aa-ddb9b812bb63"
  },
  "output": {
    "repoPath": "static/assets/animatic/frames/festival-master/stretches/festival-master-stretch-vault-recovery-080-082/festival-master-stretch-vault-recovery-080-082-rev-1-video-1.mp4",
    "sha256": "c5c7b4610364ca2276780dbc3acc736210d75826eabd0881954c416e99ba2e08",
    "durationMs": 24050,
    "width": 854,
    "height": 480,
    "mimeType": "video/mp4"
  },
  "declaredDurationMs": 24380,
  "notes": "Author approved vault-recovery-080-082; videoPromptFreeze approved; Elin voice truncated to 5s MP3; 480p omni_reference; no failed-job retry.",
  "registeredAssetId": "asset:festival-master-stretch-vault-recovery-080-082-rev-1-video-1-video"
}
