{
  "schemaVersion": "1.0.0",
  "jobId": "festival-master:stretch-reactor-optics-029-032:rev-1:video-2",
  "scriptId": "script:light-delay-festival-master",
  "stretchId": "festival-master:stretch-reactor-optics-029-032",
  "providerSnapshotId": "provider:higgsfield:seedance-2.5:2026-08-29",
  "inputDigest": "924c2067626202e1d7deb29dfce772d59f980f41af0bd4abafb82e5fe077c2b3",
  "sourceRunId": "run:festival-master:stretch-reactor-optics-029-032:rev-1:video-2:ready",
  "sourceRunPath": "reports/runs/run-festival-master-stretch-reactor-optics-029-032-rev-1-video-2-ready.json",
  "providerJobId": "e3762e4a-1381-4765-8b78-4b2b3a2e1826",
  "provider": "higgsfield-mcp-official",
  "model": "seedance-2.5",
  "artifact": "video",
  "status": "pending_review",
  "creditsSpent": 35,
  "submittedAt": "2026-09-15T10:48:56Z",
  "completedAt": "2026-09-15T10:55:00Z",
  "uploadHandles": {
    "asset:festival-master-stretch-reactor-optics-029-032-panel-02": "1f1933a1-f77b-4a09-a79b-cb9045dcc722",
    "asset:character-zao-sheet": "9ac9d629-25e6-4e96-bfad-63ecb70e705b",
    "asset:voice-ref-en-zao": "6a62dc1d-8f6f-499d-bb01-4db9ebbb874e"
  },
  "output": {
    "repoPath": "static/assets/animatic/frames/festival-master/stretches/festival-master-stretch-reactor-optics-029-032/festival-master-stretch-reactor-optics-029-032-rev-1-video-2.mp4",
    "sha256": "b955dcaf69edabfd8ab205e4dcd95f7a787e348b51a46158fbaf2cc521c51290",
    "durationMs": 14050,
    "width": 854,
    "height": 480,
    "mimeType": "video/mp4"
  },
  "declaredDurationMs": 13790,
  "notes": "Author go all four parallel; 480p omni_reference native audio; declined IN THE DARK preset 24bae836-2c4a-48e0-89b6-49fcc0b21612. Per-take package (maxMembersPerVideoJob:1). Ledger reused Zao sheet + 5s voice; keyframe panel uploaded for this job. Selected takes unchanged.",
  "registeredAssetId": "asset:festival-master-stretch-reactor-optics-029-032-rev-1-video-2-video"
}
